{
  "project_name": "demo_game",
  "status": "pass",
  "checks": [
    {
      "id": "required_scenes_exist",
      "description": "All required scene files from recipe exist.",
      "status": "pass",
      "details": "All required files exist."
    },
    {
      "id": "required_scripts_exist",
      "description": "All required script files from recipe exist.",
      "status": "pass",
      "details": "All required files exist."
    },
    {
      "id": "required_systems_exist",
      "description": "All required shared system files from recipe exist.",
      "status": "pass",
      "details": "All required files exist."
    },
    {
      "id": "required_config_files_exist",
      "description": "All required config files from recipe exist.",
      "status": "pass",
      "details": "All required files exist."
    },
    {
      "id": "scene_files_exist",
      "description": "scenes exist",
      "status": "pass",
      "details": "All scene files exist."
    },
    {
      "id": "bounded_runtime_startup",
      "description": "Project starts and runs within bounded runtime window.",
      "status": "pass",
      "details": "Runtime succeeded."
    }
  ],
  "errors": [],
  "warnings": [],
  "generated_at": "2026-03-25T07:49:45.545Z",
  "debug_output_excerpt": "[]"
}